{
  "template_version": "LIFES-AWESOME-QUOTATION-2026.1",
  "document": {
    "quote_date": "2026-08-25",
    "validity_days": 45,
    "status": "Preliminary Budgetary Draft"
  },
  "client": {
    "company": "Biztech IT Solutions Corporation",
    "attention": "Mr. Dave V. Hembrador, Chairman & CEO",
    "salutation": "Mr. Hembrador",
    "business_address": "1387 Bontong, Camaman-an\nCagayan de Oro City 9000, Philippines"
  },
  "project": {
    "title": "Supply, Delivery, Installation, Testing and Commissioning of Electronic Low-Voltage Systems - MAB Building",
    "subtitle": "Preliminary budgetary quotation based on the submitted MAB Electronic Plans",
    "location": "MAB Building"
  },
  "introduction": [
    "Lifes Awesome Ventures Inc. is pleased to submit this preliminary quotation for the supply, delivery, installation, testing and commissioning of the electronic low-voltage systems indicated in the submitted MAB Electronic Plans."
  ],
  "pricing": {
    "currency": "PHP",
    "tax_treatment": "VAT Exclusive",
    "vat_rate": 0,
    "amount_in_words": "Six Million Five Hundred Forty-Five Thousand Four Hundred Pesos Only, VAT Exclusive.",
    "sections": [
      {
        "code": "A",
        "title": "Shared MDF, IDFs, Structured Cabling and Wireless Network System",
        "items": [
          {
            "item_code": "A1",
            "quantity": 9,
            "unit": "Box",
            "title": "Pure-copper Hikvision CAT6 UTP cable, 305 meters per box",
            "description": "",
            "unit_price": 8450
          },
          {
            "item_code": "A2",
            "quantity": 5,
            "unit": "Set",
            "title": "24-port CAT6 patch panel loaded with snap-in connectors",
            "description": "",
            "unit_price": 8600
          },
          {
            "item_code": "A3",
            "quantity": 12,
            "unit": "Pc.",
            "title": "24-slot 1U horizontal cable manager",
            "description": "",
            "unit_price": 3500
          },
          {
            "item_code": "A4",
            "quantity": 10,
            "unit": "Roll",
            "title": "Five-meter Velcro cable tie",
            "description": "",
            "unit_price": 250
          },
          {
            "item_code": "A5",
            "quantity": 100,
            "unit": "Pc.",
            "title": "M6 cage nuts and rack screws",
            "description": "",
            "unit_price": 35
          },
          {
            "item_code": "A6",
            "quantity": 97,
            "unit": "Set",
            "title": "D-Link CAT6 keystone jack with faceplate and outlet box",
            "description": "",
            "unit_price": 680
          },
          {
            "item_code": "A7",
            "quantity": 2,
            "unit": "Box",
            "title": "Passthrough CAT6 RJ45 connectors",
            "description": "",
            "unit_price": 1550
          },
          {
            "item_code": "A8",
            "quantity": 1,
            "unit": "Lot",
            "title": "CAT6 patch cords, equipment cords, labels and remaining rack accessories",
            "description": "",
            "unit_price": 43640
          },
          {
            "item_code": "A9",
            "quantity": 8,
            "unit": "Unit",
            "title": "TP-Link AX3000 ceiling-mounted Wi-Fi 6 access point",
            "description": "",
            "unit_price": 12000
          },
          {
            "item_code": "A10",
            "quantity": 1,
            "unit": "Unit",
            "title": "TP-Link centralized hardware network controller",
            "description": "",
            "unit_price": 10800
          },
          {
            "item_code": "A11",
            "quantity": 4,
            "unit": "Unit",
            "title": "TP-Link 24-port managed PoE+ switch with SFP+ uplinks",
            "description": "",
            "unit_price": 38000
          },
          {
            "item_code": "A12",
            "quantity": 1,
            "unit": "Unit",
            "title": "TP-Link 48-port managed PoE+ switch with 10G SFP+ uplinks",
            "description": "",
            "unit_price": 104000
          },
          {
            "item_code": "A13",
            "quantity": 1,
            "unit": "Set",
            "title": "Complete 42U floor-mounted shared MDF data cabinet with fan, PDU and rack accessories",
            "description": "",
            "unit_price": 68500
          },
          {
            "item_code": "A14",
            "quantity": 4,
            "unit": "Set",
            "title": "Complete 18U wall-mounted shared IDF data cabinet with fan, PDU and rack accessories",
            "description": "",
            "unit_price": 32400
          },
          {
            "item_code": "A15",
            "quantity": 1,
            "unit": "Lot",
            "title": "OM3 multimode fiber-optic backbone, transceivers, ODFs, pigtails, patch cords and splicing",
            "description": "",
            "unit_price": 142000
          },
          {
            "item_code": "A16",
            "quantity": 4,
            "unit": "Unit",
            "title": "APC 1.5/1.6 kVA UPS for shared floor IDFs",
            "description": "",
            "unit_price": 20500
          },
          {
            "item_code": "A17",
            "quantity": 1,
            "unit": "Unit",
            "title": "APC 3 kVA online rack-mounted UPS for shared MDF",
            "description": "",
            "unit_price": 112000
          },
          {
            "item_code": "A18",
            "quantity": 1,
            "unit": "Lot",
            "title": "Shared main ELV cable trays, riser pathways, supports, hangers and containment for all systems",
            "description": "",
            "unit_price": 397000
          },
          {
            "item_code": "A19",
            "quantity": 1,
            "unit": "Lot",
            "title": "Installation, cable pulling, termination, labeling, network configuration, certification, testing and documentation",
            "description": "",
            "unit_price": 571350
          }
        ]
      },
      {
        "code": "B",
        "title": "IP CCTV Surveillance System",
        "items": [
          {
            "item_code": "B1",
            "quantity": 13,
            "unit": "Unit",
            "title": "Hikvision 4MP PoE network dome camera",
            "description": "",
            "unit_price": 5600
          },
          {
            "item_code": "B2",
            "quantity": 5,
            "unit": "Unit",
            "title": "Hikvision 4MP weather-resistant PoE network bullet camera",
            "description": "",
            "unit_price": 5400
          },
          {
            "item_code": "B3",
            "quantity": 1,
            "unit": "Unit",
            "title": "Hikvision 32-channel network video recorder",
            "description": "",
            "unit_price": 32000
          },
          {
            "item_code": "B4",
            "quantity": 4,
            "unit": "Unit",
            "title": "4TB surveillance-grade hard disk drive",
            "description": "",
            "unit_price": 14500
          },
          {
            "item_code": "B5",
            "quantity": 5,
            "unit": "Unit",
            "title": "24-port managed PoE CCTV switch with fiber uplinks",
            "description": "",
            "unit_price": 32500
          },
          {
            "item_code": "B6",
            "quantity": 1,
            "unit": "Lot",
            "title": "CCTV rack-mounting, patching and power-connection accessories within the shared MDF and IDFs",
            "description": "",
            "unit_price": 25000
          },
          {
            "item_code": "B7",
            "quantity": 1,
            "unit": "Unit",
            "title": "40-inch CCTV monitoring display",
            "description": "",
            "unit_price": 38000
          },
          {
            "item_code": "B8",
            "quantity": 1,
            "unit": "Lot",
            "title": "Hikvision CAT6 UTP cabling, OM3 fiber backbone, transceivers, ODFs and fiber termination",
            "description": "",
            "unit_price": 182000
          },
          {
            "item_code": "B9",
            "quantity": 1,
            "unit": "Lot",
            "title": "Camera mounts, junction boxes, connectors, branch conduits and supports",
            "description": "",
            "unit_price": 187000
          },
          {
            "item_code": "B10",
            "quantity": 1,
            "unit": "Lot",
            "title": "Installation, configuration, camera aiming, recording setup, testing, training and documentation",
            "description": "",
            "unit_price": 463900
          }
        ]
      },
      {
        "code": "C",
        "title": "Public Address and Background Music System",
        "items": [
          {
            "item_code": "C1",
            "quantity": 113,
            "unit": "Unit",
            "title": "Auveo 6W ceiling-mounted public-address speaker",
            "description": "",
            "unit_price": 1200
          },
          {
            "item_code": "C2",
            "quantity": 10,
            "unit": "Unit",
            "title": "Zone remote-control wall plate",
            "description": "",
            "unit_price": 6800
          },
          {
            "item_code": "C3",
            "quantity": 2,
            "unit": "Unit",
            "title": "Remote zone-paging microphone",
            "description": "",
            "unit_price": 20500
          },
          {
            "item_code": "C4",
            "quantity": 1,
            "unit": "Set",
            "title": "Digital audio matrix and zone-paging controller",
            "description": "",
            "unit_price": 40000